advertised,app_id,audience,category,category_type,core_mechanic,country,description,developer_name,downloads_daily,downloads_month,iap,icon,market_category,meta,name,niche,platform,production_complexity,rating_avg,rating_count,release_date,revenue_month,review_count,screenshots,snapshot_date,theme,update_date,url_appstorespy
True,com.giant.block.blast,broad,GAME_PUZZLE,GAME,match,sample,Block puzzle with daily events and leaderboard seasons.,Electronic Arts Mobile,60000,1500000,True,,puzzle,leaderboard,Block Blast Mega,block puzzle,google_play,low,4.65,99000,2023-01-15,120000.0,0,[],2026-06-04,abstract,2026-05-29,https://appstorespy.example/apps/com.giant.block.blast
False,com.indie.goods.sort.market,women_25_45,GAME_PUZZLE,GAME,sort,sample,"Sort supermarket goods across shelves, complete collections, and clear relaxing levels.",Tiny Loop Studio,42000,820000,True,,puzzle,collection,Goods Sort Market Puzzle,sort puzzle,google_play,low,4.4,8400,2026-03-12,36000.0,0,[],2026-06-04,supermarket,2026-05-30,https://appstorespy.example/apps/com.indie.goods.sort.market
True,com.pocket.goods.sort.shop,women_25_45,GAME_CASUAL,GAME,sort,sample,"A casual goods sort game with store shelves, collection goals, and hundreds of levels.",Pocket Team Games,25000,510000,True,,casual,collection,Supermarket Goods Sorting,sort puzzle,google_play,low,4.35,4200,2026-02-18,18500.0,0,[],2026-06-04,supermarket,2026-05-20,https://appstorespy.example/apps/com.pocket.goods.sort.shop
False,com.bright.tile.master.home,broad,GAME_PUZZLE,GAME,decorate,sample,"Match tiles, unlock home renovation chapters, and collect room decorations.",Bright Fox,18000,440000,True,,puzzle,renovation,Tile Master Home Story,tile match,google_play,low,4.55,6200,2025-12-20,22500.0,0,[],2026-06-04,home,2026-05-10,https://appstorespy.example/apps/com.bright.tile.master.home
False,com.word.daily.cross,seniors,GAME_WORD,GAME,other,sample,Relaxing word puzzle and crossword levels for daily brain training.,Letter Nest,12000,240000,True,,word,levels,Daily Crossword Journey,word puzzle,google_play,low,4.5,12000,2025-08-05,7000.0,0,[],2026-06-04,other,2026-05-25,https://appstorespy.example/apps/com.word.daily.cross
False,com.indie.arrow.flow,broad,GAME_PUZZLE,GAME,other,sample,"Draw arrows, solve abstract flow levels, and unlock new level packs.",North Star Play,9000,170000,True,,puzzle,levels,Arrow Flow Puzzle,arrow puzzle,google_play,low,4.25,2300,2026-04-02,4500.0,0,[],2026-06-04,abstract,2026-05-22,https://appstorespy.example/apps/com.indie.arrow.flow
